{
  "schema_version": 1,
  "categories": [
    {
      "key": "cat-cards",
      "name": "Cards",
      "slug": "cards",
      "parent": null,
      "order": 1,
      "state": "active"
    },
    {
      "key": "cat-birthday-cards",
      "name": "Birthday Cards",
      "slug": "birthday-cards",
      "parent": "cat-cards",
      "order": 2,
      "state": "active"
    },
    {
      "key": "cat-anniversary-cards",
      "name": "Anniversary Cards",
      "slug": "anniversary-cards",
      "parent": "cat-cards",
      "order": 3,
      "state": "active"
    },
    {
      "key": "cat-wedding-cards",
      "name": "Wedding Cards",
      "slug": "wedding-cards",
      "parent": "cat-cards",
      "order": 4,
      "state": "active"
    },
    {
      "key": "cat-new-baby-cards",
      "name": "New Baby Cards",
      "slug": "new-baby-cards",
      "parent": "cat-cards",
      "order": 5,
      "state": "active"
    },
    {
      "key": "cat-congratulations-cards",
      "name": "Congratulations Cards",
      "slug": "congratulations-cards",
      "parent": "cat-cards",
      "order": 6,
      "state": "active"
    },
    {
      "key": "cat-thank-you-cards",
      "name": "Thank You Cards",
      "slug": "thank-you-cards",
      "parent": "cat-cards",
      "order": 7,
      "state": "active"
    },
    {
      "key": "cat-christmas-cards",
      "name": "Christmas Cards",
      "slug": "christmas-cards",
      "parent": "cat-cards",
      "order": 8,
      "state": "active"
    },
    {
      "key": "cat-mother-s-day-cards",
      "name": "Mother's Day Cards",
      "slug": "mother-s-day-cards",
      "parent": "cat-cards",
      "order": 9,
      "state": "active"
    },
    {
      "key": "cat-father-s-day-cards",
      "name": "Father's Day Cards",
      "slug": "father-s-day-cards",
      "parent": "cat-cards",
      "order": 10,
      "state": "active"
    },
    {
      "key": "cat-valentine-s-cards",
      "name": "Valentine's Cards",
      "slug": "valentine-s-cards",
      "parent": "cat-cards",
      "order": 11,
      "state": "active"
    },
    {
      "key": "cat-other-occasion-cards",
      "name": "Other Occasion Cards",
      "slug": "other-occasion-cards",
      "parent": "cat-cards",
      "order": 12,
      "state": "active"
    },
    {
      "key": "cat-prints-and-wall-art",
      "name": "Prints & Wall Art",
      "slug": "prints-and-wall-art",
      "parent": null,
      "order": 13,
      "state": "active"
    },
    {
      "key": "cat-personalised-prints",
      "name": "Personalised Prints",
      "slug": "personalised-prints",
      "parent": "cat-prints-and-wall-art",
      "order": 14,
      "state": "active"
    },
    {
      "key": "cat-family-prints",
      "name": "Family Prints",
      "slug": "family-prints",
      "parent": "cat-prints-and-wall-art",
      "order": 15,
      "state": "active"
    },
    {
      "key": "cat-children-s-prints",
      "name": "Children's Prints",
      "slug": "children-s-prints",
      "parent": "cat-prints-and-wall-art",
      "order": 16,
      "state": "active"
    },
    {
      "key": "cat-memorial-prints",
      "name": "Memorial Prints",
      "slug": "memorial-prints",
      "parent": "cat-prints-and-wall-art",
      "order": 17,
      "state": "active"
    },
    {
      "key": "cat-wall-art",
      "name": "Wall Art",
      "slug": "wall-art",
      "parent": "cat-prints-and-wall-art",
      "order": 18,
      "state": "active"
    },
    {
      "key": "cat-seasonal-prints",
      "name": "Seasonal Prints",
      "slug": "seasonal-prints",
      "parent": "cat-prints-and-wall-art",
      "order": 19,
      "state": "active"
    },
    {
      "key": "cat-gifts",
      "name": "Gifts",
      "slug": "gifts",
      "parent": null,
      "order": 20,
      "state": "active"
    },
    {
      "key": "cat-keepsakes",
      "name": "Keepsakes",
      "slug": "keepsakes",
      "parent": "cat-gifts",
      "order": 21,
      "state": "active"
    },
    {
      "key": "cat-keyrings",
      "name": "Keyrings",
      "slug": "keyrings",
      "parent": "cat-gifts",
      "order": 22,
      "state": "active"
    },
    {
      "key": "cat-magnets",
      "name": "Magnets",
      "slug": "magnets",
      "parent": "cat-gifts",
      "order": 23,
      "state": "active"
    },
    {
      "key": "cat-tokens",
      "name": "Tokens",
      "slug": "tokens",
      "parent": "cat-gifts",
      "order": 24,
      "state": "active"
    },
    {
      "key": "cat-novelty-gifts",
      "name": "Novelty Gifts",
      "slug": "novelty-gifts",
      "parent": "cat-gifts",
      "order": 25,
      "state": "active"
    },
    {
      "key": "cat-small-gifts",
      "name": "Small Gifts",
      "slug": "small-gifts",
      "parent": "cat-gifts",
      "order": 26,
      "state": "active"
    },
    {
      "key": "cat-home-and-decor",
      "name": "Home & Décor",
      "slug": "home-and-decor",
      "parent": null,
      "order": 27,
      "state": "active"
    },
    {
      "key": "cat-signs-and-plaques",
      "name": "Signs & Plaques",
      "slug": "signs-and-plaques",
      "parent": "cat-home-and-decor",
      "order": 28,
      "state": "active"
    },
    {
      "key": "cat-door-signs",
      "name": "Door Signs",
      "slug": "door-signs",
      "parent": "cat-home-and-decor",
      "order": 29,
      "state": "active"
    },
    {
      "key": "cat-wall-plaques",
      "name": "Wall Plaques",
      "slug": "wall-plaques",
      "parent": "cat-home-and-decor",
      "order": 30,
      "state": "active"
    },
    {
      "key": "cat-picture-frames",
      "name": "Picture Frames",
      "slug": "picture-frames",
      "parent": "cat-home-and-decor",
      "order": 31,
      "state": "active"
    },
    {
      "key": "cat-freestanding-decor",
      "name": "Freestanding Décor",
      "slug": "freestanding-decor",
      "parent": "cat-home-and-decor",
      "order": 32,
      "state": "active"
    },
    {
      "key": "cat-light-up-decor",
      "name": "Light-Up Décor",
      "slug": "light-up-decor",
      "parent": "cat-home-and-decor",
      "order": 33,
      "state": "active"
    },
    {
      "key": "cat-home-accessories",
      "name": "Home Accessories",
      "slug": "home-accessories",
      "parent": "cat-home-and-decor",
      "order": 34,
      "state": "active"
    },
    {
      "key": "cat-decorations",
      "name": "Decorations",
      "slug": "decorations",
      "parent": null,
      "order": 35,
      "state": "active"
    },
    {
      "key": "cat-christmas-decorations",
      "name": "Christmas Decorations",
      "slug": "christmas-decorations",
      "parent": "cat-decorations",
      "order": 36,
      "state": "active"
    },
    {
      "key": "cat-easter-decorations",
      "name": "Easter Decorations",
      "slug": "easter-decorations",
      "parent": "cat-decorations",
      "order": 37,
      "state": "active"
    },
    {
      "key": "cat-halloween-decorations",
      "name": "Halloween Decorations",
      "slug": "halloween-decorations",
      "parent": "cat-decorations",
      "order": 38,
      "state": "active"
    },
    {
      "key": "cat-wedding-decorations",
      "name": "Wedding Decorations",
      "slug": "wedding-decorations",
      "parent": "cat-decorations",
      "order": 39,
      "state": "active"
    },
    {
      "key": "cat-party-decorations",
      "name": "Party Decorations",
      "slug": "party-decorations",
      "parent": "cat-decorations",
      "order": 40,
      "state": "active"
    },
    {
      "key": "cat-hanging-decorations",
      "name": "Hanging Decorations",
      "slug": "hanging-decorations",
      "parent": "cat-decorations",
      "order": 41,
      "state": "active"
    },
    {
      "key": "cat-freestanding-decorations",
      "name": "Freestanding Decorations",
      "slug": "freestanding-decorations",
      "parent": "cat-decorations",
      "order": 42,
      "state": "active"
    },
    {
      "key": "cat-cake-and-party",
      "name": "Cake & Party",
      "slug": "cake-and-party",
      "parent": null,
      "order": 43,
      "state": "active"
    },
    {
      "key": "cat-cake-toppers",
      "name": "Cake Toppers",
      "slug": "cake-toppers",
      "parent": "cat-cake-and-party",
      "order": 44,
      "state": "active"
    },
    {
      "key": "cat-cupcake-toppers",
      "name": "Cupcake Toppers",
      "slug": "cupcake-toppers",
      "parent": "cat-cake-and-party",
      "order": 45,
      "state": "active"
    },
    {
      "key": "cat-table-decorations",
      "name": "Table Decorations",
      "slug": "table-decorations",
      "parent": "cat-cake-and-party",
      "order": 46,
      "state": "active"
    },
    {
      "key": "cat-party-signs",
      "name": "Party Signs",
      "slug": "party-signs",
      "parent": "cat-cake-and-party",
      "order": 47,
      "state": "active"
    },
    {
      "key": "cat-party-accessories",
      "name": "Party Accessories",
      "slug": "party-accessories",
      "parent": "cat-cake-and-party",
      "order": 48,
      "state": "active"
    },
    {
      "key": "cat-celebration-accessories",
      "name": "Celebration Accessories",
      "slug": "celebration-accessories",
      "parent": "cat-cake-and-party",
      "order": 49,
      "state": "active"
    },
    {
      "key": "cat-craft-supplies",
      "name": "Craft Supplies",
      "slug": "craft-supplies",
      "parent": null,
      "order": 50,
      "state": "active"
    },
    {
      "key": "cat-blanks",
      "name": "Blanks",
      "slug": "blanks",
      "parent": "cat-craft-supplies",
      "order": 51,
      "state": "active"
    },
    {
      "key": "cat-vinyl-decals",
      "name": "Vinyl Decals",
      "slug": "vinyl-decals",
      "parent": "cat-craft-supplies",
      "order": 52,
      "state": "active"
    },
    {
      "key": "cat-embellishments",
      "name": "Embellishments",